<?xml version="1.0"?>
<lettera xmlns:xsi="http://www.w3.org/2001/XMLSchema-instance"  xsi:noNamespaceSchemaLocation="lettera.xsd">
    <mittente>Mattia</mittente>
    <data>2001-11-09</data>
    <destinatario>Destinatario</destinatario>
    <saluto>Ciao</saluto>
    <corpo>
        <paragrafo>Primo paragrafo </paragrafo>
        <paragrafo>Secondo paragrafo </paragrafo>
    </corpo>
    <chiusura>Saluto cordiale</chiusura>
    <firma>MF</firma>
</lettera>